"Zajčji hrbet z žafranom, zeliščno kvinojo in korenčkovim čipsom",11,169,7,1,30 min,30 min,1 h 0 min,MasterChef,187.92 kCal
Zajčji file v vinski marinadi s korenčkovim pirejem,17,185,6,2,20 min,20 min,40 min,MasterChef,207.1 kCal
Zajčji golaž s suhimi slivami in kremasto zeliščno polento,17,183,6,1,25 min,35 min,1 h 0 min,MasterChef,189.04 kCal
Zajec v panko drobtinah s cvetačno kremo in vinskim korenčkom,16,212,5,2,20 min,30 min,50 min,MasterChef,284.28 kCal
Smetanova strjenka,4,68,3,1,30 min,0 min,30 min,Mesec smetanovih jedi,387.46 kCal
Gorgonzolni narastek s peteršiljevo redukcijo,9,115,3,2,20 min,30 min,50 min,Mesec smetanovih jedi,300.37 kCal
S skuto polnjene piščančje prsi v smetanovi omaki z malvazijo,11,104,4,1,15 min,15 min,30 min,Mesec smetanovih jedi,178.37 kCal
"Skutni njoki v omaki s starano gaudo, lešniki in dimljenim brancinom",10,96,4,2,30 min,10 min,40 min,Mesec smetanovih jedi,279.95 kCal
Gorgonzolna juha s timijanom in ocvrtim mehko kuhanim jajcem,8,84,3,2,20 min,10 min,30 min,Mesec smetanovih jedi,231.29 kCal
Jagnječji file z dušenim rdečim zeljem in proseno polpeto,10,184,4,2,15 min,30 min,45 min,MasterChef,202.17 kCal
Jagnječji file na posteljici iz rdečega zelja in prosene kaše,12,191,6,2,15 min,30 min,45 min,MasterChef,166.34 kCal
"Svinjska ribica, zeliščno krhko testo s karamelizirano čebulo in špargljeva krema",14,203,6,2,30 min,20 min,50 min,MasterChef,158.59 kCal
"V maslu poširane kozice s paradižnikovo omako, šparglji in čipsom",11,166,5,2,10 min,35 min,45 min,MasterChef,64.6 kCal
Svinjska ribica z gorčično omako,8,160,6,1,20 min,15 min,35 min,MasterChef,131.83 kCal
Skutna tortica,7,119,3,1,5 h 20 min,10 min,5 h 30 min,Mesec prazničnih skutnih dobrot,165.43 kCal
Skutni namaz s hrenom in glaziranim jabolkom,1,70,3,1,15 min,10 min,25 min,Mesec smetanovih jedi,0 kCal
Smetanova pena s krompirjem in igverjem,6,65,2,1,15 min,20 min,35 min,Mesec smetanovih jedi,72.04 kCal
Smetanova torta z metino omako,11,112,3,2,30 min,7 min,37 min,Mesec smetanovih jedi,268.31 kCal
Skutna pita s porom in pinjolami,13,128,4,2,1 h 20 min,40 min,2 h 0 min,Mesec smetanovih jedi,377.26 kCal
Skutni kipnik s fondijem,14,133,2,2,15 min,20 min,35 min,Mesec smetanovih jedi,211.19 kCal
Žličniki iz skutne pene s solatnim šopkom in jogurtovim dresingom,10,96,3,1,30 min,0 min,30 min,Mesec smetanovih jedi,167.73 kCal
Skutni štruklji s praženimi oreščki in smetanovo kremo,18,150,5,2,1 h 20 min,30 min,1 h 50 min,Slovenska,197.32 kCal
Smetanova strjenka z gozdnimi sadeži,9,113,3,1,4 h 0 min,5 min,4 h 5 min,Mesec smetanovih jedi,461.72 kCal
Pomarančni profiteroli s čokoladno glazuro,25,373,7,2,40 min,40 min,1 h 20 min,MasterChef,273.01 kCal
Brancin v zeliščni skorjici s koromačevo kremo in pisanim čipsom,17,361,7,2,45 min,25 min,1 h 10 min,MasterChef,100.88 kCal
Rižota s škampi,11,216,6,2,35 min,25 min,1 h 0 min,MasterChef,160.46 kCal
"Srnin file z zeliščno skorjico, cvetačnim pirejem in brusnično omako",15,174,5,2,30 min,30 min,1 h 0 min,MasterChef,146.17 kCal
Tatarec iz rdeče postrvi z ohrovtovo solato in popečenim kruhkom,10,158,5,1,30 min,10 min,40 min,MasterChef,135.68 kCal
Tris cupcakeov,38,380,5,2,30 min,15 min,45 min,MasterChef,319.65 kCal
Krhko testo z orehovim nadevom in pomarančno omako,17,199,6,2,40 min,40 min,1 h 20 min,MasterChef,301.35 kCal
Popečeni polži s sotirano zelenjavo in nežno kremo,13,223,7,2,20 min,40 min,1 h 0 min,MasterChef,129.21 kCal
"Pehtranove testenine s polži, šparglji in češnjevimi paradižniki",15,169,7,2,30 min,15 min,45 min,MasterChef,185.48 kCal
Riževi rezanci z zelenjavo in teriyaki piščancem,19,238,7,2,15 min,40 min,55 min,MasterChef,70.89 kCal
Škampi v popraženih riževih rezancih s sadno-zelenjavno omako,16,124,4,2,15 min,15 min,30 min,MasterChef,196.47 kCal
Red burger,18,232,7,2,30 min,20 min,50 min,MasterChef,125.79 kCal
Piščančji burger z zeljno solato z jabolkom,22,262,6,2,45 min,15 min,1 h 0 min,MasterChef,162.04 kCal
Piščančje prsi s pistacijevo kari omako in rižem z bučkami,17,223,5,2,30 min,30 min,1 h 0 min,MasterChef,267.37 kCal
Korenčkovi ravioli z lososom,14,159,5,2,40 min,20 min,1 h 0 min,MasterChef,292.17 kCal
V kavi in vinu mariniran srnin hrbet,12,154,4,2,20 min,25 min,45 min,MasterChef,95.61 kCal
Srnin hrbet z vijoličnim krompirjem in kavno omako,12,200,6,2,20 min,25 min,45 min,MasterChef,95.92 kCal
T-bone steak s kavo,10,125,5,2,15 min,35 min,50 min,MasterChef,131.25 kCal
Klobasa s sladkim pridihom,9,160,3,2,30 min,20 min,50 min,MasterChef,141 kCal
Čufti s pirejem,16,202,8,1,30 min,30 min,1 h 0 min,MasterChef,88.57 kCal
Svinjski zrezki s pirejem,20,183,6,1,20 min,40 min,1 h 0 min,MasterChef,143.5 kCal
Zeleno-bela simfonija,11,188,5,2,20 min,20 min,40 min,MasterChef,313.99 kCal
Florentinski steak,12,209,6,2,30 min,30 min,1 h 0 min,MasterChef,175.19 kCal
T-bone steak z jagodnim pirejem in zelenjavo,14,168,5,2,40 min,20 min,1 h 0 min,MasterChef,202.69 kCal
Premium klobasa s polento,11,124,4,2,25 min,30 min,55 min,MasterChef,246.26 kCal
Orientalska klobasa z zeljem in bučnim pirejem,14,162,5,2,20 min,40 min,1 h 0 min,MasterChef,173.67 kCal
Klobasa z jabolki in ajdovo kašo,8,141,6,2,30 min,20 min,50 min,MasterChef,258.78 kCal
Zrezek z gobami in skutnim štrukljem,20,294,7,2,30 min,30 min,1 h 0 min,MasterChef,144.62 kCal
Roza krompir s piščancem v gobicah,12,169,4,1,10 min,40 min,50 min,MasterChef,106.77 kCal
Na špagetih nanizane mesne kroglice z zelenjavno omako,15,137,4,1,20 min,40 min,1 h 0 min,MasterChef,163.76 kCal
Rulada z mlečnim rižem,13,160,6,1,15 min,30 min,45 min,MasterChef,168.65 kCal
Domači zeleni rezanci bolognese,17,154,4,2,30 min,30 min,1 h 0 min,MasterChef,252.76 kCal
Hrustljavi brancin na vrtu,14,176,5,2,30 min,20 min,50 min,MasterChef,75.39 kCal
Pijani brancin,15,150,3,2,30 min,20 min,50 min,MasterChef,117.6 kCal
Jagnječje zarebrnice z bučnim taginom,16,226,4,2,20 min,40 min,1 h 0 min,MasterChef,163.8 kCal
Pečen jagenjček s kuskusom in zelenjavno omako,19,209,5,2,10 min,50 min,1 h 0 min,MasterChef,110.02 kCal
Poširan brancinov file z limoninim pirejem in zelenjavno prilogo,15,187,5,2,20 min,15 min,35 min,MasterChef,92.06 kCal
Čokoladni biskvit s karamelno omako in pehtranovim žličnikom,12,134,4,2,20 min,40 min,1 h 0 min,MasterChef,300.77 kCal
Hrustljava račka s kvinojo,15,267,4,2,10 min,50 min,1 h 0 min,MasterChef,128.88 kCal
Tempura z zelenjavo,8,68,3,1,40 min,20 min,1 h 0 min,MasterChef,167.52 kCal
Nokturni tiramisu,18,186,6,2,30 min,15 min,45 min,MasterChef,347 kCal
Pivska tagliata,18,331,6,2,30 min,30 min,1 h 0 min,MasterChef,64.39 kCal
Špinačni ravioli z nadevom iz svetlega piva,16,212,6,2,40 min,20 min,1 h 0 min,MasterChef,229.04 kCal
Chilli con carne,19,192,5,2,20 min,40 min,1 h 0 min,MasterChef,84.4 kCal
Tostade s steakom in pekočo čili omako,13,213,6,2,45 min,12 min,57 min,MasterChef,124 kCal
Vroči piščančji taco,13,126,6,1,20 min,20 min,40 min,MasterChef,119.92 kCal
Čili govedina v hrustljavem spremstvu,16,153,6,2,15 min,45 min,1 h 0 min,MasterChef,140.79 kCal
Sveži taco,19,232,6,2,20 min,35 min,55 min,MasterChef,109.22 kCal
Ameriški zajtrk,17,237,5,1,35 min,20 min,55 min,MasterChef,382.18 kCal
Sladko-slani žličniki s pečenim paradižnikom,11,178,3,1,10 min,30 min,40 min,MasterChef,175.05 kCal
Krompirjevi njoki s hrustljavo slanino,10,233,6,2,30 min,30 min,1 h 0 min,MasterChef,192.29 kCal
Obrnjena krompirjevo-čokoladna tortica s slanino,13,219,6,2,30 min,30 min,1 h 0 min,MasterChef,123.91 kCal
Rebrasti krompirček,8,206,4,1,15 min,40 min,55 min,MasterChef,119.73 kCal
Nadevani šampinjoni z mocarelo in pestom,11,147,5,1,15 min,33 min,48 min,Italijanska,289.07 kCal
Palačinke iz pretlačenega krompirja,6,173,3,1,12 min,20 min,32 min,Na hitro,138.37 kCal
Pražen riž s piščancem,9,179,4,1,10 min,12 min,22 min,Na hitro,191.79 kCal
Masa za palačinke,6,137,4,1,7 min,0 min,7 min,Triki in nasveti,258.23 kCal
Kokosov kolač,12,172,5,1,15 min,40 min,55 min,Zabava,355.94 kCal
Velikonočni šarkelj z jajčnim likerjem,12,200,6,1,25 min,1 h 0 min,1 h 25 min,Velika noč,284.72 kCal
Korenčkova torta s sladkornim oblivom,19,238,7,2,25 min,45 min,1 h 10 min,Velika noč,311.47 kCal
Pečeno jagnječje stegno z začimbami,9,269,5,2,15 min,1 h 30 min,1 h 45 min,Velika noč,164.62 kCal
Preprost jagodni kolač s cimetom,12,204,4,1,15 min,50 min,1 h 5 min,Pomlad,300.18 kCal
Skutini rogljički s šunko in sirom,11,169,5,1,30 min,25 min,55 min,Zabava,273.93 kCal
Črno-bele kocke,14,298,6,2,1 h 30 min,30 min,2 h 0 min,Slovenska,204.48 kCal
Fiadone,7,122,4,1,15 min,40 min,55 min,Brez glutena,137.05 kCal
Panna cotta s kivijem,8,237,5,1,4 h 0 min,7 min,4 h 7 min,Italijanska,247.4 kCal
Orehovo pecivo z marmelado,12,203,4,1,20 min,30 min,50 min,Slovenska,382.52 kCal
Uheljčki s klobaso in porom,8,220,6,1,10 min,25 min,35 min,Italijanska,295.16 kCal
Bradačev (barbonov) file na koromačevi posteljici,7,113,4,1,10 min,10 min,20 min,Ribe in morski sadeži,141.04 kCal
Gratinirani makaroni z mletim mesom,12,208,4,2,15 min,40 min,55 min,Slovenska,318.42 kCal
Ovsena kaša z orehi in borovnicami,7,70,2,1,5 min,10 min,15 min,Zdravo in vegi,298.36 kCal
Pražen riž s sirom in paradižniki,8,149,4,1,10 min,5 min,15 min,Slovenska,86.23 kCal
Boršč,14,281,6,2,20 min,2 h 10 min,2 h 30 min,Zima,92.28 kCal
Kruhov narastek z rozinami,13,201,5,1,1 h 20 min,40 min,2 h 0 min,Slovenska,260.59 kCal
Italijanska meringa,2,163,4,2,15 min,20 min,35 min,Sladice,254.82 kCal
Velikonočni kruhki s sadjem,17,418,6,2,1 h 50 min,50 min,2 h 40 min,Velika noč,323.5 kCal
Etonska zmešnjava,5,116,3,1,25 min,0 min,25 min,Pomlad,100.31 kCal
Polnozrnati špageti z regratom in pinjolami,9,161,4,1,10 min,15 min,25 min,Pomlad,438.6 kCal
Čokoladna pita,14,383,6,2,1 h 55 min,55 min,2 h 50 min,Slovenska,448.3 kCal
Ananasov napitek z ginom,9,160,2,1,30 min,10 min,40 min,Poletje,109.63 kCal
Uheljčki z brokolijem in inčuni,9,173,5,1,15 min,15 min,30 min,Italijanska,218.08 kCal
Piščanec s paradižniki in olivami,12,220,5,1,10 min,1 h 0 min,1 h 10 min,Okusi sveta,157.94 kCal
Kavni žele z maskarponejevo kremo,8,147,5,1,20 min,10 min,30 min,Italijanska,345.03 kCal
Kokosov puding s chia semeni,5,62,2,1,1 h 10 min,0 min,1 h 10 min,Zdravo in vegi,269.5 kCal
Presni korenčkov namaz s sončničnimi semeni,7,92,2,1,15 min,0 min,15 min,Zdravo in vegi,257.18 kCal
Sadni pire s tapioko s kokosovim mlekom,5,133,3,1,40 min,15 min,55 min,Zdravo in vegi,207.16 kCal
"Ovseni kruhki z arašidovim maslom, banano in medom",4,32,2,1,5 min,0 min,5 min,Zdravo in vegi,223.85 kCal
Jabolčna čežana z jogurtom in granolo,5,106,3,1,10 min,15 min,25 min,Zdravo in vegi,64.89 kCal
"Lazanja iz jajčevcev, mletega mesa in paradižnikove omake",10,320,6,2,20 min,50 min,1 h 10 min,Italijanska,97.15 kCal
Romantični kolački (cupcakes),12,303,7,2,40 min,25 min,1 h 5 min,Zabava,460.95 kCal
"Kolač z rikoto, mandlji in olivnim oljem",10,154,5,1,10 min,30 min,40 min,Italijanska,265.17 kCal
Semifreddo z orehi,8,307,7,2,5 h 0 min,20 min,5 h 20 min,Italijanska,388.43 kCal
Mlečni riž z rikoto in sadno omako,10,163,4,1,15 min,20 min,35 min,Pomlad,170.11 kCal
Vanilijeva panna cotta s pasijonko,6,147,4,1,3 h 0 min,10 min,3 h 10 min,Sladice,181.39 kCal
Nadevani šampinjoni s sirom,5,92,3,1,5 min,7 min,12 min,Zabava,106.34 kCal
Piščančja korma,15,158,4,1,10 min,20 min,30 min,Okusi sveta,183.94 kCal
Jabolčni kolač z jogurtom in mandlji,13,185,5,1,15 min,40 min,55 min,Dieta,324.87 kCal
Dvakrat pečeni piškoti z žafranom in pistacijami,9,263,6,2,30 min,45 min,1 h 15 min,Italijanska,381.72 kCal
Ovsena kaša z banano in oreščki,10,112,3,1,7 min,15 min,22 min,Zdravo in vegi,206.49 kCal
Špinačna kremna juha,11,174,5,1,20 min,25 min,45 min,Zelenjava,79.12 kCal
Jabolčni čips,1,97,2,1,10 min,1 h 0 min,1 h 10 min,Zdravo in vegi,25 kCal
Cvetačni ocvrtki,7,196,4,2,20 min,20 min,40 min,Zelenjava,80.46 kCal
Avokadova solata s špinačo in slanino,8,129,3,1,15 min,7 min,22 min,Zelenjava,176.1 kCal
Halva z grškim žafranom,5,60,2,1,1 h 10 min,15 min,1 h 25 min,Zabava,215.19 kCal
Ribji fileji v zeliščni skorjici na cvetačnem pireju,16,235,6,1,15 min,20 min,35 min,Ribe in morski sadeži,104.45 kCal
Sendvič s svinjsko pečenko in zeljno solato,11,110,3,1,20 min,0 min,20 min,Predjedi in prigrizki,240.19 kCal
Svinjski kotleti z ananasom,10,160,4,1,10 min,15 min,25 min,Kuhinje,88.13 kCal
Zapečene testenine s klobaso,14,273,5,2,15 min,50 min,1 h 5 min,Italijanska,306.86 kCal
Tropski smoothie,5,68,2,1,15 min,0 min,15 min,Zdravo in vegi,79.27 kCal
Vroča čokolada s sladkornimi penicami,4,42,2,1,5 min,10 min,15 min,Kuhinje,541.99 kCal
Čokoladno-bananin kolač,11,221,4,1,15 min,1 h 15 min,1 h 30 min,Piknik in žar,318.29 kCal
Browniji z malinami,8,219,4,1,15 min,40 min,55 min,Zabava,379.96 kCal
Limonina pita z beljakovim pokrovom,17,524,8,2,1 h 30 min,50 min,2 h 20 min,Zabava,334.75 kCal
New York cheesecake,12,316,6,2,20 min,50 min,1 h 10 min,Kuhinje,377.89 kCal
Piščanec po maroško z marelicami in mandlji,16,176,5,1,7 min,1 h 20 min,1 h 27 min,Kuhinje,204.16 kCal
Rigatoni z mesnimi kroglicami v paradižnikovi omaki,18,246,5,2,15 min,30 min,45 min,Italijanska,212.47 kCal
Srčni krofki,12,335,6,2,1 h 40 min,18 min,1 h 58 min,Pust,374.17 kCal
Počasi pečene jagnječje krače v čebulni omaki,7,259,5,2,10 min,3 h 20 min,3 h 30 min,Božič in novo leto,138.65 kCal
Limonina rižota z dimljenim lososom,12,199,5,2,15 min,25 min,40 min,Valentinovo,338.37 kCal
Juha iz pečenega pastinaka,10,203,6,2,15 min,50 min,1 h 5 min,Zima,146.01 kCal
Fokača z olivami in rožmarinom,9,221,3,2,1 h 35 min,20 min,1 h 55 min,Italijanska,335.94 kCal
Kruhki s prepraženimi gobicami,7,106,3,1,20 min,25 min,45 min,Zabava,62.02 kCal
Bananin kolač z jogurtom,8,188,5,1,10 min,1 h 15 min,1 h 25 min,Piknik in žar,233.18 kCal
Preprost jabolčni kolač,13,257,4,1,20 min,1 h 0 min,1 h 20 min,Jesen,276.9 kCal
Piščančje prsi z gobicami in hrustljavimi parmezanovimi drobtinami,11,203,4,2,15 min,32 min,47 min,Zabava,176.85 kCal
Paella s piščancem in chorizom,15,233,5,2,15 min,30 min,45 min,Meso,252.75 kCal
Goveji ragu z rdečim vinom,15,254,5,2,30 min,2 h 5 min,2 h 35 min,Meso,182.37 kCal
Pečene piščančje prsi s fižolom in klobaso,11,182,4,1,10 min,35 min,45 min,Zima,149.84 kCal
Topla čičerikina solata s klobaso,7,107,4,1,10 min,10 min,20 min,Solate,210.34 kCal
Zapečena cvetača in brokoli v sirovi omaki,11,173,3,2,20 min,30 min,50 min,Zelenjava,118.21 kCal
Pesina solata s feto,6,135,3,1,15 min,40 min,55 min,Zdravo in vegi,101.78 kCal
Domače arašidovo maslo,4,127,4,1,15 min,12 min,27 min,Namazi,559.94 kCal
Češnjev poljub,6,56,2,1,5 min,0 min,5 min,Valentinovo,0 kCal
Ljubezenski napoj,7,65,2,1,5 min,0 min,5 min,Valentinovo,0 kCal
Amorjeva puščica,6,63,2,1,5 min,0 min,5 min,Valentinovo,0 kCal
Pire iz jajčevcev,6,109,3,1,20 min,1 h 0 min,1 h 20 min,Zdravo in vegi,75.51 kCal
Ameriške palačinke z banano,8,190,5,1,12 min,20 min,32 min,Sladice,248.44 kCal
Jabolčni kolač s cimetom,10,193,6,1,20 min,1 h 20 min,1 h 40 min,Jesen,407.28 kCal
Sirova pita z brokolijem,13,369,7,2,1 h 5 min,57 min,2 h 2 min,Vegetarijanstvo,231.72 kCal
Juha iz pečenega krompirja,8,282,5,1,15 min,1 h 20 min,1 h 35 min,Zima,88.22 kCal
Jabolčni žepki z brusnicami in orehi,11,142,3,1,20 min,25 min,45 min,Slovenska,279.42 kCal
Kruhov narastek s šunko in sirom,10,119,4,1,30 min,45 min,1 h 15 min,Kosilo,203.15 kCal
V olupku pečen krompir z maslom,3,116,3,1,10 min,1 h 0 min,1 h 10 min,Zelenjava,107.06 kCal
Počasi pečen piščanec s krompirjem,9,198,4,1,15 min,2 h 20 min,2 h 35 min,Slovenska,204.77 kCal
Cvetačna pica s krompirjem in kozjim sirom,11,224,6,2,15 min,30 min,45 min,Zdravo in vegi,101.43 kCal
Karijeva pomaka,8,41,2,1,10 min,0 min,10 min,Vegetarijanstvo,198.02 kCal
Čokoladni trufli z rumom,6,188,5,2,5 h 0 min,3 min,5 h 3 min,Zabava,536.56 kCal
Valentinovi kolački (cupcakes),13,268,6,2,40 min,20 min,1 h 0 min,Valentinovo,315.96 kCal
Korenčkova juha s koriandrom,9,149,4,1,15 min,23 min,38 min,Zdravo in vegi,74.28 kCal
Makovi kolački (cupcakes) z limetino kremo,13,252,6,1,40 min,22 min,1 h 2 min,Zabava,382.16 kCal
Dušena jabolka z robidnicami in orehovimi maslenimi drobtinami,11,214,4,1,10 min,25 min,35 min,Jesen,265.37 kCal
Čokoladni fondant,8,237,6,1,35 min,14 min,49 min,Zabava,432.14 kCal
Rdeči žametni cheesecake,16,410,8,2,40 min,1 h 25 min,2 h 5 min,Kuhinje,387.87 kCal
Zdrobovo pecivo z jogurtom in mandlji,11,165,5,1,20 min,35 min,55 min,Zabava,336.49 kCal
Belokranjska pogača,9,248,4,2,1 h 0 min,25 min,1 h 25 min,Slovenska,331.73 kCal
Pečena cvetača z začimbami,8,103,3,1,15 min,40 min,55 min,Zdravo in vegi,55.6 kCal
Čokoladni crème brûlée,7,237,5,2,30 min,40 min,1 h 10 min,Valentinovo,426.9 kCal
Ocvrte jabolčne rezine z limončelom,11,171,5,2,20 min,20 min,40 min,Zima,281.88 kCal
Fižolova solata s tuno in suhimi paradižniki,10,90,2,1,15 min,0 min,15 min,Zdravo in vegi,157.9 kCal
Hitra tunina pica iz bagete,7,139,4,1,10 min,12 min,22 min,Zabava,222.24 kCal
Čičerikine polpete,9,164,5,1,25 min,8 min,33 min,Zdravo in vegi,175.04 kCal
"S šunko, sirom in jajci nadevan kruh",9,128,4,1,2 h 20 min,0 min,2 h 20 min,Zabava,198.31 kCal
Pečen krompir s kremnim sirčkom,8,212,4,2,15 min,1 h 0 min,1 h 15 min,Zelenjava,144.74 kCal
Nabodala s pekočimi kozicami in čilijevo omako,10,188,5,1,40 min,12 min,52 min,Zabava,96.09 kCal
Pečene krvavice,2,63,3,1,5 min,40 min,45 min,Meso,379 kCal
Jabolčna pita z marmelado,11,256,5,1,1 h 30 min,40 min,2 h 10 min,Slovenska,200.81 kCal
Pečene krompirjeve rezine s papriko,5,85,3,1,10 min,35 min,45 min,Vegetarijanstvo,96.47 kCal
Portugalski tunin namaz,7,62,2,1,10 min,0 min,10 min,Piknik in žar,319.68 kCal
Kolački z olivami in rožmarinom,8,159,3,1,20 min,18 min,38 min,Zabava,390.69 kCal
Sočna torta s klementinami,6,234,5,1,30 min,2 h 30 min,3 h 0 min,Zima,250.67 kCal
Rulada z belo čokolado in malinami,12,377,7,2,2 h 30 min,27 min,2 h 57 min,Zabava,286.19 kCal
Pokovka z javorjevim sirupom in pekan orehi,8,184,4,2,15 min,12 min,27 min,Zabava,555.31 kCal
Grški jogurt z gozdnimi sadeži,7,69,2,1,8 min,7 min,15 min,Vegetarijanstvo,66.89 kCal
Korenčkov sok z ingverjem,3,28,2,1,10 min,0 min,10 min,Zdravo in vegi,41 kCal
Fižolova enolončnica s klobaso,13,154,4,1,10 min,35 min,45 min,Zima,152.6 kCal
Tortilje z govejim mesom,14,181,5,1,15 min,1 h 0 min,1 h 15 min,Mehiška,139.49 kCal
Pečene hruške z brusnicami,7,148,3,1,20 min,30 min,50 min,Jesen,93.91 kCal
Rženi dvojni čokoladni mafini,11,147,5,1,15 min,18 min,33 min,Piknik in žar,300.66 kCal
"Pica s špinačo, čebulo in pinjolami",12,239,5,1,25 min,20 min,45 min,Italijanska,209.74 kCal
Ribje palčke z remuladno omako,15,195,5,1,20 min,15 min,35 min,Kuhinje,159.19 kCal
Porova pita z dimljeno postrvjo,15,386,7,2,1 h 45 min,55 min,2 h 40 min,Piknik in žar,196.95 kCal
Sojina panna cotta s kavnim sirupom,7,181,4,1,4 h 15 min,15 min,4 h 30 min,Zdravo in vegi,381.29 kCal
Pečene račje prsi,3,156,4,2,5 min,26 min,31 min,Valentinovo,123 kCal
Kuhana kisla repa,4,57,2,1,5 min,30 min,35 min,Zdravo in vegi,28 kCal
Lečna enolončnica s klobaso,12,169,4,1,15 min,50 min,1 h 5 min,Zima,253.05 kCal
Dušen zajec v rdečem vinu,14,190,5,2,15 min,55 min,1 h 10 min,Zima,103.81 kCal
Lečna juha s slanino,12,151,4,2,12 min,38 min,50 min,Jesen,279.55 kCal
Ovsena kaša s cimetom in popraženimi jabolki,9,108,4,1,10 min,15 min,25 min,Zdravo in vegi,192.07 kCal
Pitice z jajčevci,7,174,4,2,15 min,35 min,50 min,Zabava,220.25 kCal
Mangov čatni z jabolkom,14,219,5,1,20 min,1 h 10 min,1 h 30 min,Kuhinje,120.9 kCal
Tajske piščančje polpete,9,129,5,1,15 min,8 min,23 min,Okusi sveta,147.3 kCal
Divjačinski ragu z vinom,16,235,6,2,20 min,1 h 50 min,2 h 10 min,Meso,148.51 kCal
Klapavice v kremni karijevi omaki,7,170,4,1,30 min,15 min,45 min,Zabava,115.28 kCal
Domači prijatelji,7,108,4,1,15 min,40 min,55 min,Zabava,423.88 kCal
Piščanec z limono in brokolijem,11,174,4,1,12 min,12 min,24 min,Azijska,148.38 kCal
Zapečene testenine z lososom,9,178,4,1,15 min,45 min,1 h 0 min,Zima,226.61 kCal
Krhki mandljevi polmeseci,8,186,3,1,1 h 20 min,15 min,1 h 35 min,Božič in novo leto,486.67 kCal
Marmorirani beljakovi poljubčki,3,171,6,1,15 min,40 min,55 min,Zabava,253.61 kCal
Pečena zimska zelenjava s curryjem in timijanom,10,138,3,1,15 min,40 min,55 min,Zima,41.96 kCal
Vložene limone z rožmarinom,5,94,4,1,20 min,5 min,25 min,Zima,27.89 kCal
Jagnječja pečenka z granatnim jabolkom,10,192,5,2,30 min,1 h 15 min,1 h 45 min,Božič in novo leto,250.62 kCal
Kmečka terina s pistacijami,15,262,6,2,30 min,1 h 45 min,2 h 15 min,Zabava,186.5 kCal
Pečena začinjena čičerika,8,124,4,1,15 min,35 min,50 min,Zdravo in vegi,196.47 kCal
Rižota s pečeno peso in glaziranim korenjem,20,350,7,2,30 min,1 h 35 min,2 h 5 min,Vegetarijanstvo,136.11 kCal
Sirup z začimbami,6,99,4,1,10 min,30 min,40 min,Božič in novo leto,367.56 kCal
Piškoti z makadamijo in brusnicami,8,174,5,1,30 min,12 min,42 min,Kuhinje,461.97 kCal
Torta Pavlova s češnjami in čokolado,10,259,6,2,30 min,1 h 30 min,2 h 0 min,Zabava,208.7 kCal
Preprosta brusnična omaka,4,63,2,1,5 min,13 min,18 min,Slovenska,143.39 kCal
Pečen krompir z zelišči in parmezanom,8,166,3,1,10 min,45 min,55 min,Italijanska,115.58 kCal
Pečena glazirana šunka,10,198,4,1,25 min,2 h 40 min,3 h 5 min,Velika noč,128.23 kCal
Italijanski piškoti s suhim sadjem in oreščki,10,220,4,2,15 min,1 h 0 min,1 h 15 min,Kotanyi,301.18 kCal
Limonin sorbet v lupinici,4,186,5,2,3 h 40 min,10 min,3 h 50 min,Zabava,314.21 kCal
Čokoladni razpokančki,11,133,5,2,1 h 20 min,10 min,1 h 30 min,Gorazdova slaščičarna,404.73 kCal
Veseli whoopiji,13,175,5,2,1 h 0 min,10 min,1 h 10 min,Gorazdova slaščičarna,471.77 kCal
Sočne orehove lunice,10,159,5,2,30 min,30 min,1 h 0 min,Gorazdova slaščičarna,442.07 kCal
Florentinski piškotki,9,172,6,2,1 h 0 min,25 min,1 h 25 min,Gorazdova slaščičarna,388.04 kCal
Kremni kavni koktajl z začimbami,7,46,2,1,10 min,0 min,10 min,Božič in novo leto,344.09 kCal
Vložene biserne čebulice,7,88,4,2,30 min,15 min,45 min,Domači pripravki,104.98 kCal
Praznični punč z rumom,8,82,4,1,15 min,10 min,25 min,Božič in novo leto,111.21 kCal
Mesna štruca z zelišči,22,217,6,1,12 min,1 h 10 min,1 h 22 min,Meso,213.32 kCal
Gratinirane klapavice,8,169,4,1,30 min,10 min,40 min,Zabava,136.06 kCal
Pekoči čokoladni sendviči,5,184,6,3,2 h 0 min,10 min,2 h 10 min,Gorazdova slaščičarna,561.33 kCal
Žele iz kalamansija,5,128,3,2,3 h 0 min,20 min,3 h 20 min,Gorazdova slaščičarna,236.32 kCal
Buča s kostanjem in čebulo,8,107,4,1,15 min,20 min,35 min,Jesen,74.35 kCal
Kruhki s piščančjimi jetrci in čebulo,8,142,4,1,15 min,15 min,30 min,Zabava,156.72 kCal
Torta Caprese,7,142,4,1,15 min,45 min,1 h 0 min,Italijanska,429.26 kCal
Božična rulada,16,314,8,2,50 min,20 min,1 h 10 min,Božič in novo leto,298.62 kCal
Praznični semifreddo,7,260,5,2,4 h 20 min,10 min,4 h 30 min,Italijanska,265.61 kCal
Bajadere,5,161,6,2,2 h 0 min,5 min,2 h 5 min,Gorazdova slaščičarna,572.5 kCal
Pralineji s slanino in solnim cvetom,8,298,7,3,1 h 40 min,10 min,1 h 50 min,Gorazdova slaščičarna,534.16 kCal
Krompirjeva zloženka s špinačo in slanino,9,252,5,2,20 min,55 min,1 h 15 min,Kosilo,120.54 kCal
Gibanica kot juha,28,276,6,3,50 min,20 min,1 h 10 min,Gorazdova slaščičarna,321.08 kCal
Gorazdova gibanica,22,265,7,2,45 min,45 min,1 h 30 min,Gorazdova slaščičarna,231.03 kCal
Pečen por,4,114,3,1,10 min,45 min,55 min,Jesen,100 kCal
Pica polžki,6,116,3,1,20 min,20 min,40 min,Zabava,238.71 kCal
Telečji zvitki s pršutom in parmezanom,13,214,4,2,15 min,15 min,30 min,Italijanska,386.63 kCal
"Palačinke s piščancem, gobami in špinačo",17,274,5,1,15 min,40 min,55 min,Kosilo,193.97 kCal
Pikantne piščančje krače,8,138,4,1,15 min,44 min,59 min,Zabava,196.77 kCal
Pečen limonin cheesecake,11,228,5,2,20 min,50 min,1 h 10 min,Zabava,345.12 kCal
Čokoladni namaz s prekajeno slanino,7,74,3,2,1 h 10 min,10 min,1 h 20 min,Gorazdova slaščičarna,439.24 kCal
Čokoladna salama,5,76,3,2,30 min,0 min,30 min,Gorazdova slaščičarna,545.57 kCal
Azteška vroča čokolada,12,102,2,1,35 min,10 min,45 min,Gorazdova slaščičarna,459.29 kCal
Krompir Dauphine,8,139,3,2,15 min,55 min,1 h 10 min,Zima,197.05 kCal
Telečja rulada s špinačnim nadevom,24,361,8,2,30 min,2 h 0 min,2 h 30 min,Božič in novo leto,146.47 kCal
Telečja obara,13,180,4,2,20 min,50 min,1 h 10 min,Slovenska,81.55 kCal
Bananin kruh z datlji in orehi,10,178,5,1,15 min,45 min,1 h 0 min,Piknik in žar,255.35 kCal
Namaz iz pečenih paprik in orehov,8,83,3,1,10 min,2 min,12 min,Zabava,269.87 kCal
Koktajl G mix,5,29,1,1,5 min,0 min,5 min,Zabava,0 kCal
Koktajl Začinjena jesen,7,45,2,1,5 min,0 min,5 min,Zabava,295.08 kCal
Koktajl Vroči stol,6,46,2,1,5 min,0 min,5 min,Zabava,0 kCal
Koktajl Mladi šef,6,46,2,1,5 min,0 min,5 min,Zabava,0 kCal
Koktajl Dišeči izziv,8,69,2,2,10 min,0 min,10 min,Zabava,173.91 kCal
"Koktajl Ja, šef!",7,42,2,1,5 min,0 min,5 min,Zabava,0 kCal
Piščančji polpetki,11,94,3,1,15 min,15 min,30 min,Slovenska,164.38 kCal
Ocvrti puranji trakci s korenčkom in grahom,14,106,3,1,15 min,12 min,27 min,Meso,122.25 kCal
Piščančje kroglice,12,124,3,1,10 min,20 min,30 min,Slovenska,125.24 kCal
Presne energijske tablice,10,116,3,2,2 h 15 min,0 min,2 h 15 min,Gorazdova slaščičarna,289.76 kCal
Mandljev otok v mareličnem morju,10,84,3,2,20 min,0 min,20 min,Gorazdova slaščičarna,215.79 kCal
Presni jagodni puding,7,93,3,1,4 h 10 min,0 min,4 h 10 min,Gorazdova slaščičarna,60.91 kCal
Avokadov čokoladni mousse s kokosovo smetano,4,71,2,1,10 min,0 min,10 min,Gorazdova slaščičarna,171.43 kCal
Kostanjev krožnik s kandirano pomarančno lupino,15,202,4,2,20 min,3 h 0 min,3 h 20 min,Gorazdova slaščičarna,366.26 kCal
Torta Mont Blanc,11,225,6,2,30 min,3 h 0 min,3 h 30 min,Gorazdova slaščičarna,291.74 kCal
Hladna gorčična omaka z zelišči in kaprami,10,45,3,1,5 min,0 min,5 min,Zabava,257.79 kCal
