Ime recepta,Število sestavin,Število besed v receptu,Število odstavkov,Težavnost,Čas priprave,Čas kuhanja,Skupni čas,Vrsta kuhinje,Energijska vrednost na porcijo
V pečici pečene polnjene (filane) paprike,17,231,7,1,30 min,1 h 40 min,2 h 10 min,Kosilo,146 kCal
Sataraš,7,107,4,1,15 min,20 min,35 min,Balkanska,68.62 kCal
Solata s stročjim fižolom in krompirjem,13,119,6,1,25 min,15 min,40 min,Solate,80.16 kCal
Preprost kolač s slivami,12,180,5,1,15 min,1 h 0 min,1 h 15 min,Sladice,370.4 kCal
Affogato,3,45,2,1,5 min,0 min,5 min,Pijača,231.3 kCal
Zelenjavna enolončnica z omako pistou,17,201,5,1,15 min,40 min,55 min,Poletje,75.52 kCal
Grška krompirjeva musaka,16,343,8,1,20 min,1 h 30 min,1 h 50 min,Kosilo,156.44 kCal
Pecivo z malinami in pudingom,16,206,7,1,20 min,40 min,1 h 0 min,Sladice,301.15 kCal
Polnjeni lignji s pršutom in sirom,9,245,8,1,15 min,35 min,50 min,Ribe in morski sadeži,138.39 kCal
Kumare v omaki,10,181,6,1,10 min,30 min,40 min,Brez mesa,34.76 kCal
Breskove rezine,12,136,7,1,35 min,55 min,1 h 30 min,Pecivo,217.59 kCal
Bučkin wrap s tuninim nadevom,14,138,7,1,25 min,25 min,50 min,LCHF,91.89 kCal
Hitri skutini cmoki s sadjem,7,152,3,1,55 min,10 min,1 h 5 min,Kaj skuhati,110.74 kCal
Tiramisu semifreddo,9,279,7,1,40 min,4 h 0 min,4 h 40 min,Sladice,312.52 kCal
Kremna limonina pita brez peke,6,100,4,1,15 min,0 min,15 min,Sladice,465.29 kCal
Zelenjavna lazanja,15,335,7,1,30 min,1 h 5 min,1 h 35 min,Kaj skuhati,265.92 kCal
Jogurtova panakota z jagodičevjem,9,146,5,1,15 min,20 min,35 min,Sladice,112.52 kCal
Skutina zvezda s špinačo,13,299,11,1,1 h 20 min,35 min,1 h 55 min,Zabava,157.65 kCal
Polnjeni lignji v paradižnikovi omaki,10,316,7,1,40 min,20 min,1 h 0 min,Ribe in morski sadeži,116.09 kCal
Polnjene paprike brez mesa,16,271,9,1,30 min,1 h 0 min,1 h 30 min,Zelenjava,78.67 kCal
Polpeti iz prosene kaše z zelenjavo,12,215,6,1,10 min,35 min,45 min,Brez mesa,186.25 kCal
Rolada z bučkami in mletim mesom,8,127,5,1,20 min,30 min,50 min,Video recepti,188.53 kCal
Raffaello cheesecake,15,215,7,1,45 min,5 min,50 min,Torta,446.57 kCal
"Stročji fižol s krompirjem, ocvirki in smetano",5,80,3,1,10 min,20 min,30 min,Slovenska,82.92 kCal
Hitra slivova pita,13,138,5,1,20 min,45 min,1 h 5 min,Sladice,290.9 kCal
Blitva s krompirjem in česnom,5,120,3,1,10 min,35 min,45 min,Zelenjava,51.06 kCal
Sataraš z rižem,8,106,5,1,10 min,40 min,50 min,Poletje,29.19 kCal
Zavitek z vanilijevo kremo in borovnicami,9,199,6,1,15 min,35 min,50 min,Sladice,270.21 kCal
Sivkin sirup,6,173,4,1,15 min,10 min,25 min,Domači pripravki,187.83 kCal
Beli fižol z blitvo in sirom,13,74,5,1,10 min,15 min,25 min,Brez mesa,101.18 kCal
Poletna torta z malinami,10,278,5,2,30 min,10 min,40 min,Sladice,342.27 kCal
Lahka musaka z bučkami,16,292,7,2,15 min,1 h 50 min,2 h 5 min,Kosilo,166.44 kCal
Lignji po tržaško s tatarsko omako,12,242,7,1,15 min,20 min,35 min,Kaj skuhati,179.64 kCal
Jogurtove rezine s sadjem in piškoti (brez peke),10,228,9,1,30 min,15 min,45 min,Sladice,143.5 kCal
Vložena zelenjava,8,159,6,1,50 min,15 min,1 h 5 min,Domači pripravki,0 kCal
Čokoladni sladoled brez strojčka,4,48,2,1,10 min,0 min,10 min,Sladice,483.21 kCal
Paprike s krompirjem v pečici,9,126,5,1,15 min,45 min,1 h 0 min,Kosilo,58.38 kCal
Piščančje kroglice v zelenjavni omaki,13,194,6,1,15 min,30 min,45 min,Kosilo,110.39 kCal
Preprosto jogurtovo pecivo z marelicami,10,173,7,1,10 min,40 min,50 min,Sladice,312.21 kCal
Stročji fižol z zaseko in kislo smetano,5,89,3,1,10 min,30 min,40 min,Zelenjava,76.23 kCal
Poletni krompirjev narastek,8,139,4,1,20 min,26 min,46 min,Poletje,81.02 kCal
Marelična marmelada z manj sladkorja,5,219,6,1,20 min,45 min,1 h 5 min,Domači pripravki,103.3 kCal
Sladica v kozarcu z jagodami in rabarbaro,12,253,6,1,20 min,15 min,35 min,Sladice,191.84 kCal
Bučkine rezine z jogurtom in sirom,11,172,6,1,15 min,45 min,1 h 0 min,Poletje,125.55 kCal
Klafuti z breskvami in malinami,13,168,5,1,10 min,55 min,1 h 5 min,Sladice,160.82 kCal
"Enolončnica s papriko, mletim mesom in rižem",14,232,6,1,10 min,45 min,55 min,Juhe in jedi na žlico,137.81 kCal
Krompirjeva solata s čebulo in slanino,10,116,6,1,10 min,30 min,40 min,Piknik in žar,99.57 kCal
Hitra bučkina pita s skuto,8,117,5,1,10 min,30 min,40 min,Zelenjava,164.93 kCal
Hitro skutino pecivo z borovnicami in drobljencem,17,162,6,1,20 min,1 h 0 min,1 h 20 min,Sladice,246.35 kCal
Poletna zelenjavna mineštra,16,178,5,1,15 min,30 min,45 min,Juhe in jedi na žlico,48.42 kCal
Čokoladna torta brez peke,4,121,4,1,15 min,0 min,15 min,Torta,443.81 kCal
Zapečene bučke in krompir,10,201,4,1,15 min,50 min,1 h 5 min,Poletje,110.68 kCal
Najhitreje pripravljeno testo za pico,7,114,2,1,40 min,0 min,40 min,Italijanska,380.3 kCal
Pistacijeva krema s češnjami v kozarcu,12,183,5,1,30 min,15 min,45 min,Sladice,280.39 kCal
Tunina jajčna pita brez testa,7,87,3,1,10 min,35 min,45 min,Piknik in žar,180.3 kCal
Pasticciotto,15,219,9,2,45 min,30 min,1 h 15 min,Pecivo,402.19 kCal
Zapečeni njoki v paradižnikovi omaki z mascarponejem,13,222,7,1,10 min,20 min,30 min,Kosilo,122.56 kCal
Čokoladna torta brez moke s češnjami in smetano,7,227,7,1,30 min,30 min,1 h 0 min,Brez glutena,324.08 kCal
Hrustljavo pečen mladi krompir,5,246,5,1,10 min,55 min,1 h 5 min,Zelenjava,94.37 kCal
Ražnjiči s svinjino in papriko,7,120,4,1,45 min,8 min,53 min,Meso,159.81 kCal
Sipin golaž z domačimi rezanci,16,321,8,1,20 min,2 h 20 min,2 h 40 min,Ribe in morski sadeži,105.81 kCal
Jagodne rezine brez peke,10,180,6,1,15 min,5 min,20 min,Sladice,325.49 kCal
Torta St. Honore (iz MasterChefa),17,335,9,1,1 h 20 min,40 min,2 h 0 min,MasterChef,249.53 kCal
Opera torta (iz MasterChefa),23,242,7,1,1 h 50 min,40 min,2 h 30 min,MasterChef,364.93 kCal
Paris Brest (iz MasterChefa),19,327,7,1,2 h 0 min,30 min,2 h 30 min,MasterChef,259.71 kCal
Medena torta medovik (iz MasterChefa),8,217,6,1,1 h 40 min,30 min,2 h 10 min,MasterChef,375.52 kCal
Kvašeni masleni rogljički,13,325,8,2,3 h 0 min,20 min,3 h 20 min,Pecivo,389.54 kCal
Polnjene paprike iz pečice,10,235,6,1,15 min,35 min,50 min,Kaj skuhati,135.97 kCal
Mediteranske piščančje kroglice z jogurtovo pomako,16,81,5,1,15 min,20 min,35 min,Na hitro,159.73 kCal
Polpeti iz blitve in krompirja,11,106,6,1,15 min,15 min,30 min,Zelenjava,78.38 kCal
Češnjeve kremne rezine,15,180,5,1,45 min,15 min,1 h 0 min,Sladice,292.39 kCal
Zapečene palačinke z mletim mesom in zelenjavo,19,302,8,1,20 min,40 min,1 h 0 min,Kosilo,196.13 kCal
Piščančji zrezki v kremni omaki s sušenimi paradižniki,10,200,6,1,5 min,25 min,30 min,Kaj skuhati,233.81 kCal
Hitro pecivo z jagodami,9,136,5,1,15 min,15 min,30 min,Pecivo,183.73 kCal
Listnati zavitek z marmelado in mascarponejem,10,212,9,1,15 min,30 min,45 min,Pecivo,269.83 kCal
Babičino pecivo s sadjem,14,129,5,1,10 min,35 min,45 min,Pecivo,91.25 kCal
Hitre ovsene rezine s skuto in paradižniki,10,93,6,1,10 min,45 min,55 min,Zdravo in vegi,158.93 kCal
Ocvrte mesne polpete,11,200,5,1,20 min,15 min,35 min,Meso,223.14 kCal
Špargljeva juha s krompirjem,7,237,7,1,10 min,25 min,35 min,Juhe in jedi na žlico,71.07 kCal
Krhke košarice z mascarpone kremo in sadjem,13,278,7,1,30 min,20 min,50 min,Pecivo,423.7 kCal
Pečene marinirane perutničke,9,179,6,1,5 min,40 min,45 min,Meso,244.44 kCal
Jagodna pita z mrežo,11,297,8,1,1 h 0 min,1 h 0 min,2 h 0 min,Sladice,259.56 kCal
Testenine s paradižnikom in burrato,7,146,7,1,10 min,10 min,20 min,Testenine in žita,220.87 kCal
Češnjeva pita z maskarponejevo kremo,13,199,4,2,1 h 15 min,40 min,1 h 55 min,Pomlad,336.84 kCal
Langaš z jogurtom,8,189,4,1,4 h 30 min,30 min,5 h 0 min,Predjedi in prigrizki,255.5 kCal
Bezgov sirup z jagodami,6,153,5,1,30 min,0 min,30 min,Triki in nasveti,140.59 kCal
Piščančji file v smetanovi omaki s špinačo in suhimi paradižniki,12,210,6,1,5 min,18 min,23 min,Meso,164.63 kCal
Jagodna kupola,10,148,6,2,30 min,0 min,30 min,Sladice,172.01 kCal
V pečici pečena vratovina s krompirjem,6,155,4,1,10 min,1 h 38 min,1 h 48 min,Kosilo,120.65 kCal
Borovničeve cheesecake rezine,15,274,8,1,15 min,50 min,1 h 5 min,Pecivo,282.2 kCal
Pomladna skleda s šparglji,17,134,6,1,10 min,10 min,20 min,Zdravo in vegi,189.77 kCal
Hitri pita kruhki,6,98,4,1,20 min,15 min,35 min,Piknik in žar,383.17 kCal
Clafoutis (klafuti) z jagodami,11,143,5,1,10 min,40 min,50 min,Sladice,117.48 kCal
Palačinke brez mleka,6,120,3,1,10 min,0 min,10 min,Sladice,243.63 kCal
Rolada z vanilijevo kremo in jagodami,13,320,9,1,1 h 30 min,15 min,1 h 45 min,Sladice,250.18 kCal
Sofficini,15,182,5,2,15 min,25 min,40 min,Italijanska,304.43 kCal
Bezgova panakota z limoninim sirupom,7,200,6,1,10 min,20 min,30 min,Sladice,328.4 kCal
Skutin narastek (brez moke),11,189,5,1,10 min,45 min,55 min,Brez glutena,130.23 kCal
Testenine z morskimi sadeži,10,117,6,1,5 min,15 min,20 min,Na hitro,152.68 kCal
Krhka torta z malinami,12,201,6,2,40 min,55 min,1 h 35 min,Pomlad,365.35 kCal
Piščančji gyros,24,254,7,1,30 min,15 min,45 min,Piknik in žar,146.46 kCal
"Pecivo s piškoti, pudingom in višnjami",8,219,7,1,30 min,0 min,30 min,Sladice,227.65 kCal
Golaž s kruhovimi cmoki,23,334,10,1,15 min,2 h 40 min,2 h 55 min,Kosilo,133.33 kCal
Testeninska solata,12,163,5,1,15 min,10 min,25 min,Piknik in žar,114.53 kCal
Tunin namaz z jajci,6,75,3,1,15 min,10 min,25 min,Ribe in morski sadeži,184 kCal
Dušena vratovina v omaki s papriko,11,249,8,1,10 min,2 h 0 min,2 h 10 min,Meso,135.95 kCal
Borovničev tiramisu v kozarcu,11,184,5,1,30 min,15 min,45 min,Sladice,367.08 kCal
Aperol Spritz,5,36,2,1,5 min,0 min,5 min,Zabava,0 kCal
Domače lepinje,6,272,7,2,1 h 20 min,10 min,1 h 30 min,Piknik in žar,373.4 kCal
Jagodna panakota,12,257,7,1,30 min,15 min,45 min,Sladice,196.26 kCal
Donavski valovi,15,366,10,1,25 min,40 min,1 h 5 min,Sladice,372.84 kCal
Špargljeva rižota,11,320,9,1,10 min,1 h 10 min,1 h 20 min,Brez mesa,117.31 kCal
Mesna pita s krompirjem,11,284,9,1,15 min,50 min,1 h 5 min,Glavne jedi,186.63 kCal
Rižota s piščancem in zelenjavo,12,155,4,1,10 min,30 min,40 min,Testenine in žita,168.79 kCal
Borovničeve ombre rezine,15,251,6,1,30 min,10 min,40 min,Sladice,331.25 kCal
Kremna piščančja juha s testeninami,16,152,6,1,15 min,35 min,50 min,Juhe in jedi na žlico,155.19 kCal
Tortilje z mletim mesom,16,180,11,1,30 min,30 min,1 h 0 min,Kosilo,155.89 kCal
Svinjska ribica v listnatem testu,10,293,7,2,35 min,50 min,1 h 25 min,Zabava,168.73 kCal
Italijansko testo za pico,5,221,6,2,2 h 30 min,0 min,2 h 30 min,Italijanska,349.65 kCal
Sočni čokoladni browniji brez bele moke,9,177,5,1,10 min,25 min,35 min,Sladice,425.25 kCal
Piščančja juha z zdrobovimi žličniki,15,339,9,1,10 min,1 h 20 min,1 h 30 min,Juhe in jedi na žlico,65.64 kCal
Hitra rižota z morskimi sadeži,13,157,6,1,10 min,25 min,35 min,Večerja,216.82 kCal
Čokoladna rolada,16,456,12,1,1 h 0 min,12 min,1 h 12 min,Sladice,335.67 kCal
Pečena prosena kaša z jabolki in skuto,13,223,6,1,15 min,1 h 0 min,1 h 15 min,Sladice,92.12 kCal
Testenine z lososovo omako iz pečice,8,175,6,1,5 min,30 min,35 min,Na hitro,248.83 kCal
Jogurtove rezine s kosmiči in sadjem,13,138,6,1,15 min,45 min,1 h 0 min,Sladice,209.3 kCal
Kardinalove rezine,17,194,8,1,15 min,35 min,50 min,Pecivo,281.73 kCal
Špargljeva kremna juha,10,176,5,1,10 min,20 min,30 min,Zdravo in vegi,72.83 kCal
Jogurtova torta z borovnicami (brez peke),10,262,8,1,3 h 19 min,0 min,3 h 19 min,Torta,231.12 kCal
Zapečen krompir s šunko in sirom v bešamel omaki,7,133,5,1,20 min,1 h 20 min,1 h 40 min,Kosilo,108.54 kCal
Zrezki v zelenjavni omaki,11,174,6,1,5 min,35 min,40 min,Kaj skuhati,147.26 kCal
Bučni njoki s hitro sirovo omako,13,224,8,1,30 min,10 min,40 min,Kosilo,145.11 kCal
Listnati zavitek z mletim mesom,12,194,7,1,10 min,35 min,45 min,Kaj skuhati,239.28 kCal
Špargljevo-bučkina juha s proseno kašo,8,128,6,1,5 min,35 min,40 min,Juhe in jedi na žlico,50.09 kCal
Bananini mafini,12,180,7,1,15 min,20 min,35 min,Sladice,260.33 kCal
Zapečene krpice s šunko in sirom,9,184,6,1,10 min,50 min,1 h 0 min,Testenine in žita,273.47 kCal
Masleni piškoti z regratom,5,127,6,1,50 min,20 min,1 h 10 min,Pomlad,487.69 kCal
Pečen krompir s šparglji in slanino,8,165,5,1,10 min,40 min,50 min,Pomlad,67.28 kCal
Pomladna fokača,7,109,6,2,1 h 40 min,15 min,1 h 55 min,Zabava,316.85 kCal
Regratov sirup,4,147,4,1,15 min,25 min,40 min,Zdravo in vegi,150.05 kCal
Vanilijeva panakota z jagodnim prelivom,10,194,7,1,30 min,15 min,45 min,Sladice,103.36 kCal
Orehovo pecivo s kislo smetano,11,115,6,1,20 min,25 min,45 min,Pecivo,312.44 kCal
Hitra koruzna zlevanka s koprivami,11,150,6,1,10 min,35 min,45 min,Kaj skuhati,283.08 kCal
Gorenjska prata,7,155,4,2,15 min,30 min,45 min,Slovenska,207.36 kCal
Velikonočna čokoladna krema,6,101,5,1,20 min,0 min,20 min,Velika noč,287.94 kCal
Slane velikonočne pletenice,9,230,6,2,1 h 40 min,30 min,2 h 10 min,Velika noč,438.31 kCal
Hren z jajci in bučnim oljem,6,71,3,1,10 min,10 min,20 min,Velika noč,131.9 kCal
Polnjena velikonočna jajca (obarvana v pesinem soku),10,172,4,1,1 h 15 min,20 min,1 h 35 min,Priložnostno,72.87 kCal
Korenčkova rolada z maskarpone kremo,18,324,11,1,40 min,20 min,1 h 0 min,Velika noč,231.75 kCal
Kvašeni velikonočni zajčki,10,221,10,1,1 h 30 min,15 min,1 h 45 min,Velika noč,290.87 kCal
Pisana mehiška rižota,15,170,6,1,10 min,20 min,30 min,Testenine in žita,217.47 kCal
Pehtranova pletenica,16,228,7,2,1 h 0 min,50 min,1 h 50 min,Sladice,216.83 kCal
Čemaževi njoki s skuto in mandlji,9,193,7,2,30 min,40 min,1 h 10 min,Brez mesa,211.65 kCal
Koruzni njoki s toskansko omako,15,158,6,1,20 min,10 min,30 min,Kosilo,300.46 kCal
Svinjski kotleti in krompir iz pečice,7,143,4,1,15 min,1 h 30 min,1 h 45 min,Kosilo,143.6 kCal
Tiramisu z jagodami,9,255,6,1,30 min,3 min,33 min,Sladice,226.57 kCal
Potratna rolada,15,290,9,1,40 min,15 min,55 min,Priložnostno,290.91 kCal
Vanilijeva krema za košarice in ladjice,8,233,7,2,30 min,10 min,40 min,Sladice,331.66 kCal
Nagubana pita s sirom,9,63,4,1,15 min,45 min,1 h 0 min,Kaj skuhati,168.25 kCal
Puranji zrezki v naravni omaki,6,141,5,1,5 min,20 min,25 min,Kosilo,152.63 kCal
Nemški velikonočni kolač,17,262,7,1,30 min,30 min,1 h 0 min,Velika noč,346.51 kCal
Rižota s pikantno papriko in korenjem,9,78,4,1,5 min,30 min,35 min,Priloge,338.53 kCal
Ajdova rižota z gobami in špinačo,12,257,5,1,10 min,30 min,40 min,Testenine in žita,151.77 kCal
Makova roža,18,190,7,2,0 min,45 min,45 min,Sladice,404.65 kCal
Makaronovo meso (makaronflajš),12,124,5,1,10 min,40 min,50 min,Kaj skuhati,211.09 kCal
Hrustljavo pečen krompir,4,118,4,1,5 min,55 min,1 h 0 min,Priloge,68.93 kCal
Piščančji medaljoni v smetanovi omaki,8,177,6,1,5 min,16 min,21 min,Na hitro,219.01 kCal
Pečena prosena kaša z zelenjavo,17,198,6,1,15 min,50 min,1 h 5 min,Kaj skuhati,124.69 kCal
Hitro in sočno jabolčno pecivo,12,143,7,1,15 min,40 min,55 min,Sladice,261.49 kCal
Svinjski golaž s smetano in papriko,13,146,7,1,15 min,20 min,35 min,Kosilo,93.96 kCal
Puranji polpeti z zelišči,8,170,5,1,15 min,10 min,25 min,Meso,204.83 kCal
Svinjski zrezki v smetanovi omaki,7,133,4,1,3 min,20 min,23 min,Meso,167.14 kCal
Piščančja juha s palačinkinimi zvitki,16,230,7,2,20 min,2 h 0 min,2 h 20 min,Juhe in jedi na žlico,179.87 kCal
Pečena ovsena kaša z jabolki in rozinami,11,83,5,1,5 min,40 min,45 min,Zajtrk,211.5 kCal
Krhke Nutelline rolice,9,198,5,1,15 min,15 min,30 min,Sladice,425.23 kCal
Hitro orehovo pecivo z mascarpone kremo,14,73,3,1,15 min,30 min,45 min,Sladice,119.66 kCal
"Lazanja s piščancem, gobami in špinačo",14,243,8,1,15 min,55 min,1 h 10 min,Kosilo,191.69 kCal
Domača kremšnita,10,223,7,1,40 min,20 min,1 h 0 min,Pecivo,172.37 kCal
Jabolčni narastek z mandlji,15,205,5,1,10 min,25 min,35 min,Sladice,227.13 kCal
"Krompirjev narastek z zelenjavo, pršutom in sirom",13,227,9,1,15 min,55 min,1 h 10 min,Kosilo,106.01 kCal
Pohane šnite (ocvrte kruhove rezine),6,115,3,1,10 min,5 min,15 min,Slovenska,217.46 kCal
Nutelline palčke,4,124,6,1,20 min,20 min,40 min,Pecivo,331.78 kCal
Krompirjevi svaljki,8,134,6,1,30 min,35 min,1 h 5 min,Kaj skuhati,162.36 kCal
Zapečene testenine z bolonjsko omako,13,221,7,1,15 min,1 h 15 min,1 h 30 min,Kaj skuhati,182.9 kCal
Orada v pečici s krompirjem,8,184,5,1,10 min,40 min,50 min,Ribe in morski sadeži,74.29 kCal
Cheesecake z jagodami (brez peke),12,244,7,1,2 h 30 min,0 min,2 h 30 min,Sladice,296.87 kCal
Domača bolonjska omaka,12,200,5,1,10 min,1 h 5 min,1 h 15 min,Omake,143.17 kCal
Sirovi tortelini z brokolijem in slanino,7,137,3,1,10 min,10 min,20 min,Na hitro,284.71 kCal
Palačinke s skuto in rozinami,14,183,4,1,35 min,20 min,55 min,Sladice,238.03 kCal
Mongolska govedina,10,214,7,1,10 min,10 min,20 min,Azijska,206.43 kCal
Krhko pecivo s pudingovo kremo in jagodami,15,328,11,1,30 min,50 min,1 h 20 min,Sladice,249.33 kCal
Svinjska ribica s pečenim korenjem,13,122,4,1,10 min,48 min,58 min,Meso,99.83 kCal
Pastirska pita,21,314,8,2,35 min,1 h 50 min,2 h 25 min,Meso,154.61 kCal
Oslič s krompirjem in zelenjavo iz pečice,11,103,6,1,10 min,45 min,55 min,Ribe in morski sadeži,83.65 kCal
Piščančji zrezki v gobovi omaki,10,249,6,1,10 min,30 min,40 min,Kosilo,127.03 kCal
Golaževa juha,12,217,6,1,20 min,1 h 25 min,1 h 45 min,Juhe in jedi na žlico,106.66 kCal
Limonine cheesecake rezine,15,343,9,2,30 min,50 min,1 h 20 min,Pecivo,320.66 kCal
Zelenjavna enolončnica s čičeriko,16,83,4,1,15 min,30 min,45 min,Brez mesa,98.36 kCal
Puhasti ameriški krofi,11,267,7,2,2 h 45 min,15 min,3 h 0 min,Sladice,365.91 kCal
Piščančja obara z zdrobovimi žličniki,15,356,7,1,15 min,1 h 0 min,1 h 15 min,Juhe in jedi na žlico,88.86 kCal
Kremna juha iz pečene cvetače,9,274,8,1,15 min,55 min,1 h 10 min,Juhe in jedi na žlico,64.23 kCal
Meso iz juhe v omaki,14,85,4,1,10 min,25 min,35 min,Kosilo,88.55 kCal
Telečji zrezki v čebulni omaki,9,106,6,1,10 min,1 h 0 min,1 h 10 min,Kosilo,87.1 kCal
Italijanski krompirjevi kroketi,8,291,8,1,40 min,1 h 0 min,1 h 40 min,Predjedi in prigrizki,121.04 kCal
Zapečeni njoki z bolonjsko omako,3,96,5,1,5 min,20 min,25 min,Na hitro,197.84 kCal
Salzburški žličniki,9,175,6,1,15 min,12 min,27 min,Sladice,218.8 kCal
Zapečeno kislo zelje s klobasami,10,151,5,1,10 min,50 min,1 h 0 min,Kosilo,193.44 kCal
Krhki flancati,11,159,4,2,50 min,20 min,1 h 10 min,Slovenska,341.01 kCal
Ričet s prekajenim svinjskim vratom,12,203,4,1,5 min,1 h 15 min,1 h 20 min,Juhe in jedi na žlico,178.01 kCal
Mehki krofi iz pečice,15,225,7,2,1 h 0 min,12 min,1 h 12 min,Pust,360.29 kCal
Pečeni piščanec v mleku,9,153,5,2,5 min,2 h 0 min,2 h 5 min,Kaj skuhati,175.27 kCal
Beneške miške z vanilijevo kremo,16,230,9,2,30 min,40 min,1 h 10 min,Sladice,311.04 kCal
Vratovina v čebulni omaki,9,271,7,1,10 min,40 min,50 min,Meso,144.26 kCal
Kruhova štruca (rolada),8,151,5,1,20 min,35 min,55 min,Priloge,217.82 kCal
Kvašen cmok z marmelado (germknödel),11,342,9,1,45 min,15 min,1 h 0 min,Sladice,359.83 kCal
Palačinka iz pečice,6,168,5,1,10 min,25 min,35 min,Kaj skuhati,243.75 kCal
"Solata z radičem, krompirjem in piščancem",8,156,6,1,10 min,30 min,40 min,Solate,135.76 kCal
Pečen piščanec in krompir v paradižnikovi omaki,10,213,6,1,10 min,55 min,1 h 5 min,Kosilo,125.02 kCal
Njoki v kremni omaki z lososom,9,172,6,1,2 min,20 min,22 min,Na hitro,140.04 kCal
Zapečene palačinke z lešnikovim nadevom,9,217,5,1,15 min,30 min,45 min,Sladice,404.75 kCal
Segedin golaž s češkimi cmoki,18,338,7,2,1 h 0 min,1 h 20 min,2 h 20 min,Kaj skuhati,187.38 kCal
Gratinirana cvetača,9,106,3,1,12 min,40 min,52 min,Zima,104.08 kCal
Čokoladne rezine z banano,14,247,7,2,40 min,25 min,1 h 5 min,Pecivo,412.22 kCal
Zapečeni skutino-špinačni cmoki (gnudi) v paradižnikovi omaki,17,217,10,1,15 min,35 min,50 min,Brez mesa,123.33 kCal
Karpati torta s sadjem,19,454,11,1,1 h 0 min,45 min,1 h 45 min,Sladice,262.36 kCal
Porova kremna juha,11,148,6,1,10 min,30 min,40 min,Juhe in jedi na žlico,152.41 kCal
Hitra mesna pita brez testa,11,109,4,1,15 min,30 min,45 min,Glavne jedi,205.98 kCal
Rafaelo krofi,23,445,11,2,2 h 0 min,30 min,2 h 30 min,Sladice,400.42 kCal
Zelenjavna juha s klobaso,14,144,4,1,10 min,27 min,37 min,Juhe in jedi na žlico,90.36 kCal
Svinjski ragu po italijansko,12,266,7,2,15 min,2 h 35 min,2 h 50 min,Glavne jedi,138.43 kCal
Topli sendvič s tuno,10,152,6,1,10 min,10 min,20 min,Na hitro,206.22 kCal
Limonin kolač z rikoto,11,157,6,1,10 min,55 min,1 h 5 min,Italijanska,298.09 kCal
Pečena jajca v začinjeni omaki s fižolom,11,234,6,1,10 min,40 min,50 min,Jajčne jedi,97.48 kCal
Hitro in sočno skutino pecivo,13,123,4,1,15 min,35 min,50 min,Sladice,267.22 kCal
Zapečena prosena kaša s suhimi slivami,9,147,3,1,15 min,1 h 5 min,1 h 20 min,Slovenska,161.12 kCal
Krompirjeva musaka,12,180,6,1,15 min,1 h 0 min,1 h 15 min,Kosilo,125.57 kCal
Hitre miške z jabolkom in rozinami,14,263,8,1,10 min,20 min,30 min,Sladice,256.47 kCal
Bananine rezine s skutino kremo,16,175,6,1,40 min,20 min,1 h 0 min,Sladice,208.71 kCal
Ajdov kruh z orehi,8,159,6,1,1 h 30 min,45 min,2 h 15 min,Slovenska,401.29 kCal
Hrustljavi zdrobovi kroketi,7,138,5,2,20 min,20 min,40 min,Priloge,196.58 kCal
Njoki z omako carbonara,8,151,4,1,5 min,20 min,25 min,Italijanska,381.77 kCal
Piščančji paprikaš s smetano,12,252,6,2,10 min,1 h 0 min,1 h 10 min,Glavne jedi,162.65 kCal
Čokoladno-kavni mousse,5,179,7,2,20 min,5 min,25 min,Sladice,472.39 kCal
Mlečno testo za pico,7,152,3,1,1 h 30 min,0 min,1 h 30 min,Italijanska,387.63 kCal
Hitro skutino pecivo brez moke,11,138,4,1,10 min,45 min,55 min,Zabava,183.47 kCal
Piščanec v smetanovi omaki,9,93,4,1,5 min,20 min,25 min,Na hitro,197.52 kCal
Milijonska juha,7,81,5,1,10 min,22 min,32 min,Juhe in jedi na žlico,112.32 kCal
Kruhovi cmoki s kremasto gobovo omako,18,356,8,2,15 min,30 min,45 min,Kosilo,232.11 kCal
Kokosovi razpokančki z limono,10,243,5,1,39 min,15 min,54 min,Božič in novo leto,301.16 kCal
Pečen losos s smetanovo omako,13,118,5,1,10 min,20 min,30 min,Božič in novo leto,228.2 kCal
Torta iz beljakov in pudinga,8,179,7,1,20 min,35 min,55 min,Sladice,370.68 kCal
Praznična sladica s penino (brez peke),6,123,5,1,15 min,7 min,22 min,Sladice,358.81 kCal
Sarma iz pečice,16,232,4,1,40 min,5 h 0 min,5 h 40 min,Kosilo,225.55 kCal
Pomarančne rezine z mascarponejem,14,260,9,1,40 min,35 min,1 h 15 min,Pecivo,270.07 kCal
Kvašeni pujski s hrenovkami,11,136,4,1,1 h 40 min,25 min,2 h 5 min,Zabava,345.15 kCal
Čokoladni piškoti s kremo,15,347,9,2,1 h 0 min,25 min,1 h 25 min,Božič in novo leto,508.94 kCal
Fileji postrvi v masleni česnovi omaki,8,243,6,1,10 min,15 min,25 min,Večerja,192.17 kCal
Božični punč,10,105,4,1,5 min,10 min,15 min,Pijača,350.6 kCal
Sočna pečenka z zelenjavno omako,11,156,5,1,15 min,3 h 0 min,3 h 15 min,Meso,166.68 kCal
Praznični marmorni kolač,14,224,8,1,30 min,50 min,1 h 20 min,Sladice,283.2 kCal
Božična tortica v kozarcu (brez peke),12,241,6,1,30 min,10 min,40 min,Sladice,301 kCal
Njoki v smetanovi omaki s pršutom,7,140,5,1,5 min,15 min,20 min,Na hitro,117.54 kCal
Praznični marmorni kolač,14,224,8,1,30 min,50 min,1 h 20 min,Sladice,283.2 kCal
Slana božična drevesa,4,112,6,1,10 min,25 min,35 min,Video recepti,339.15 kCal
Zapečeno kislo zelje s piščancem (podvarak),11,215,5,1,5 min,2 h 0 min,2 h 5 min,Balkanska,111.37 kCal
Božični kolač s suhim sadjem,17,226,7,1,30 min,1 h 5 min,1 h 35 min,Božič in novo leto,382.47 kCal
Sončna skutina pogača (štajerska gibanica),17,225,8,2,1 h 30 min,50 min,2 h 20 min,Slovenska,200.25 kCal
Svinjska rolada z zeljem in slanino,10,254,7,1,15 min,1 h 45 min,2 h 0 min,Meso,167.47 kCal
Praznični cheesecake v kozarcu,8,109,4,1,20 min,0 min,20 min,Božič in novo leto,273.53 kCal
Tiramisu kroglice,8,186,6,1,1 h 0 min,0 min,1 h 0 min,Zabava,360.86 kCal
Sočna makova torta s čokolado,11,291,8,1,20 min,35 min,55 min,Sladice,421.85 kCal
Praznična sladica v kozarcu,14,342,10,1,2 h 20 min,15 min,2 h 35 min,Božič in novo leto,289.1 kCal
Široki rezanci s kremno orehovo omako,7,192,6,1,5 min,15 min,20 min,Na hitro,360.38 kCal
Svinjski medaljoni v kremni gobovi omaki,11,213,7,1,10 min,20 min,30 min,Na hitro,116.7 kCal
Kokosovi rogljički s čokolado,8,147,3,1,1 h 20 min,15 min,1 h 35 min,Božič in novo leto,469.53 kCal
Čokoladno-pomarančna smetanova torta,17,290,6,2,40 min,35 min,1 h 15 min,Zabava,278.08 kCal
Brezglutenski piškoti alfajores,9,164,7,1,30 min,8 min,38 min,Božič in novo leto,386.39 kCal
Brstični ohrovt z mandlji in čebulo,7,105,4,1,15 min,25 min,40 min,Zelenjava,107.39 kCal
Piškoti orehi,10,112,5,2,1 h 0 min,15 min,1 h 15 min,Pecivo,525.76 kCal
Tartiflette,9,252,8,1,10 min,1 h 10 min,1 h 20 min,Kuhinje,163.25 kCal
Snežne kepe z vanilijevo omako,9,224,6,2,30 min,15 min,45 min,Sladice,123.08 kCal
Miklavževo medeno pecivo,12,208,5,1,35 min,40 min,1 h 15 min,Sladice,312.72 kCal
Parklji,14,307,7,3,1 h 30 min,25 min,1 h 55 min,Slovenska,374.01 kCal
Mehki medenjaki z limonino glazuro,13,161,7,1,2 h 45 min,12 min,2 h 57 min,Božič in novo leto,359.19 kCal
Skutini (sirovi) štruklji z drobtinami,10,228,6,2,30 min,45 min,1 h 15 min,Slovenska,216.47 kCal
Pečeno kislo zelje s kotleti in klobasami,8,175,5,1,15 min,1 h 15 min,1 h 30 min,Zima,141.39 kCal
Lečina pečenka,28,125,5,1,15 min,1 h 0 min,1 h 15 min,Brez mesa,216.53 kCal
Sladko božično drevo iz listnatega testa,5,148,6,2,20 min,20 min,40 min,Božič in novo leto,320.17 kCal
Butterscotch puding,12,222,7,2,10 min,10 min,20 min,Sladice,379.78 kCal
Pečeno zelje s sirovo omako,8,149,6,1,5 min,45 min,50 min,Zelenjava,98.94 kCal
Azijska solata s teriyaki prelivom,19,122,4,1,25 min,0 min,25 min,Zdravo in vegi,62.64 kCal
Jabolčno pecivo s pudingom,15,200,5,1,20 min,25 min,45 min,Sladice,86.84 kCal
Vratovina s kislo repo in pire krompirjem iz pečice,15,178,8,1,15 min,1 h 5 min,1 h 20 min,Kosilo,103.08 kCal
Piškoti s kosmiči in jabolki,13,195,6,1,20 min,15 min,35 min,Sladice,315.53 kCal
Žličniki z jajcem,9,223,7,1,5 min,15 min,20 min,Brez mesa,278.34 kCal
